{
    "$schema": "http://json-schema.org/draft-07/schema#",
    
    "title": "CLI Configuration Schema",
    "description": "Schema for validating CLI behavior configuration of the FHNLab application.",
  
    "type": "object",
    "additionalProperties": false,
  
    "properties": {
      "app_name": {
        "type": "string",
        "description": "Name of the application used in CLI output, logs, and help messages.",
        "minLength": 1
      },
  
      "version_check": {
        "type": "boolean",
        "description": "Whether to check application and configuration version compatibility on startup."
      },
  
      "verbosity": {
        "type": "string",
        "description": "Verbosity level of CLI output.",
        "enum": ["debug", "info", "warning", "error"]
      },
  
      "use_colors": {
        "type": "boolean",
        "description": "Enable or disable colored output in the terminal."
      },
  
      "show_progress": {
        "type": "boolean",
        "description": "Whether to display progress bars or progress indicators during long-running operations."
      },
  
      "interactive": {
        "type": "boolean",
        "description": "Enable interactive CLI behavior such as prompts and confirmations."
      },
  
      "confirm_destructive_actions": {
        "type": "boolean",
        "description": "Require confirmation before performing destructive or irreversible actions."
      },
  
      "default_profile": {
        "type": "string",
        "description": "Name of the default execution profile used when none is explicitly provided.",
        "minLength": 1
      },
  
      "default_experiments_path": {
        "type": "string",
        "description": "Default path where experiment configurations are located.",
        "minLength": 1
      },
  
      "default_configs_path": {
        "type": "string",
        "description": "Root directory containing configuration files such as profiles, database, logging, etc.",
        "minLength": 1
      },
  
      "output": {
        "type": "object",
        "description": "Configuration of CLI output formatting.",
        "additionalProperties": false,
  
        "properties": {
          "format": {
            "type": "string",
            "description": "Output format used by the CLI.",
            "enum": ["table", "json", "yaml"]
          },
  
          "float_precision": {
            "type": "integer",
            "description": "Number of decimal places used when displaying floating-point numbers.",
            "minimum": 0,
            "maximum": 16
          },
  
          "truncate_long_values": {
            "type": "boolean",
            "description": "Whether to truncate long values (paths, arrays, matrices) in CLI output."
          }
        },
  
        "required": ["format", "float_precision", "truncate_long_values"]
      },
  
      "errors": {
        "type": "object",
        "description": "Configuration related to error handling and diagnostics.",
        "additionalProperties": false,
  
        "properties": {
          "show_traceback": {
            "type": "boolean",
            "description": "Whether to display full Python traceback when an error occurs."
          },
  
          "suggest_fixes": {
            "type": "boolean",
            "description": "Whether the CLI should attempt to suggest fixes or corrective actions when errors occur."
          }
        },
  
        "required": ["show_traceback", "suggest_fixes"]
      }
    },
  
    "required": [
      "app_name",
      "version_check",
      "verbosity",
      "use_colors",
      "show_progress",
      "interactive",
      "confirm_destructive_actions",
      "default_profile",
      "default_experiments_path",
      "default_configs_path",
      "output",
      "errors"
    ]
  }
  